{
  "$schema": "urn:programmable:applicant-submission:1.1.0",
  "schemaVersion": "1.1.0",
  "intake": {
    "repository": "0xprogrammable/hookbuilder",
    "repositoryId": 1320085947
  },
  "applicant": {
    "githubLogin": "voladelta",
    "launchWallet": "0x20c9d5674f3b31d23acF76Ceca8C8691E8e08408"
  },
  "source": {
    "repository": "https://github.com/voladelta/lucky-hook",
    "repositoryId": 1326630533,
    "commit": "94d4294de7f03e54ee806de98f021cd7a9c94db6",
    "tree": "52fcf8ec9ddd57e25e203306e2813c10c9d49d13"
  },
  "identifiers": {
    "hookId": "random-holder-rewards",
    "hookVersion": "1.0.0",
    "templateId": "custom-hook",
    "templateVersion": "1.0.0",
    "modelId": "random-holder-rewards",
    "modelVersion": "1.0.0"
  },
  "hook": {
    "addressFlagMask": "0x00cc",
    "permissions": {
      "beforeInitialize": false,
      "afterInitialize": false,
      "beforeAddLiquidity": false,
      "afterAddLiquidity": false,
      "beforeRemoveLiquidity": false,
      "afterRemoveLiquidity": false,
      "beforeSwap": true,
      "afterSwap": true,
      "beforeDonate": false,
      "afterDonate": false,
      "beforeSwapReturnDelta": true,
      "afterSwapReturnDelta": true,
      "afterAddLiquidityReturnDelta": false,
      "afterRemoveLiquidityReturnDelta": false
    }
  },
  "fee": {
    "amountPips": 1000,
    "denominator": 1000000,
    "currencyBasis": "quote",
    "recipient": "0x4957f49620AFf3Adbbe8195a4f633E49cc93376c",
    "mutable": false
  },
  "requestedRoute": {
    "routeId": "custom-graph",
    "routeVersion": "1.0.0",
    "chainId": "1"
  },
  "requestedActions": ["review"],
  "notes": "Launch-wallet declaration updated at the applicant's request; the previous declaration is superseded. This remains review-only and does not authorize any transaction. Native-ETH quote hook with immutable launch rates, four-quadrant return-delta accounting, bounded holder rewards, and native-paid VRF reserve funding. Public VRF subscription binding, independent review, deployment, routing, and availability remain separate gates."
}
