{
  "$schema": "urn:programmable:applicant-submission:1.1.0",
  "schemaVersion": "1.1.0",
  "intake": {
    "repository": "0xprogrammable/hookbuilder",
    "repositoryId": 1320085947
  },
  "applicant": {
    "githubLogin": "jesse-stahl",
    "launchWallet": "0xceeBB3A6543CeBEB2ED66963897A0abEA52A50cC"
  },
  "source": {
    "repository": "https://github.com/jesse-stahl/shards-v1",
    "repositoryId": 1329073878,
    "commit": "b78c549b54dc9ee0ada8326fa461bcfe2d1bf9fa",
    "tree": "d53ad05e771e5f0b46a7b4b21d1c75f0dc5bf5c3"
  },
  "identifiers": {
    "hookId": "shards-v1",
    "hookVersion": "1.0.0",
    "templateId": "custom-hook",
    "templateVersion": "1.0.0",
    "modelId": "shards",
    "modelVersion": "1.0.0"
  },
  "hook": {
    "addressFlagMask": "0x20cc",
    "permissions": {
      "beforeInitialize": true,
      "afterInitialize": false,
      "beforeAddLiquidity": false,
      "afterAddLiquidity": false,
      "beforeRemoveLiquidity": false,
      "afterRemoveLiquidity": false,
      "beforeSwap": true,
      "afterSwap": true,
      "beforeDonate": false,
      "afterDonate": false,
      "beforeSwapReturnDelta": true,
      "afterSwapReturnDelta": true,
      "afterAddLiquidityReturnDelta": false,
      "afterRemoveLiquidityReturnDelta": false
    }
  },
  "fee": {
    "amountPips": 10000,
    "denominator": 1000000,
    "currencyBasis": "quote",
    "recipient": "0x4957f49620AFf3Adbbe8195a4f633E49cc93376c",
    "mutable": true
  },
  "requestedRoute": {
    "routeId": "custom-graph",
    "routeVersion": "1.0.0",
    "chainId": "1"
  },
  "requestedActions": [
    "review"
  ],
  "notes": "Inclusive 1.00% (10000 pips) on the native-ETH quote leg, never additive. 1000 pips is the Programmable liability to the declared recipient, a compile-time constant no launch or builder can redirect. The 9000-pip project share is 8000 pips to NFT holders via an internal per-piece accumulator with a holder-called claim path, and 1000 pips to the builder at 0xceeBB3A6543CeBEB2ED66963897A0abEA52A50cC. mutable is true only because that builder destination is rotatable by the current builder; the rate and the Programmable destination are immutable. A 10000-piece on-chain generative ERC-721 market-made against two permanently locked single-sided positions in native ETH; collection profile is sync-custom-zero-amm, not standard-amm. Both return-delta branches perform real accounting. Sizes are tight: ShardHookV1 runtime is 24358 bytes."
}
